{
  "report_version": "1.0",
  "generated_at": "2026-07-20T10:00:00+08:00",
  "strategy_id": "example_momentum",
  "requested_profile": "daily-bar-v1",
  "capabilities": [
    {
      "capability": "stock_daily_backtest",
      "required": true,
      "event_type": "bar",
      "schema_status": "AVAILABLE",
      "data_status": "AVAILABLE",
      "adapter_status": "AVAILABLE",
      "provider_status": "READY",
      "engine_status": "READY",
      "platform_status": "READY",
      "execution_status": "READY",
      "evidence": ["stock_daily schema", "DuckDB daily provider", "daily engine"],
      "message": "日线股票回测链路可执行。",
      "remediation": []
    },
    {
      "capability": "stock_1m_backtest",
      "required": false,
      "event_type": "bar",
      "schema_status": "AVAILABLE",
      "data_status": "DATA_MISSING",
      "adapter_status": "AVAILABLE",
      "provider_status": "AVAILABLE",
      "engine_status": "ENGINE_MISSING",
      "platform_status": "PLATFORM_DEPENDENT",
      "execution_status": "BLOCKED",
      "evidence": ["stock_minutes schema", "PR3 Provider frequency routing (query_minute_bars_by_range)"],
      "message": "PR3 已贯通 Provider 频率路由（provider_status=AVAILABLE，仅表代码链路就绪，不得解释为分钟回测可用）。data_status 仍为 DATA_MISSING（分钟表空），engine_status 仍为 ENGINE_MISSING（PR4 分钟事件引擎未完成），整体 BLOCKED。",
      "remediation": ["完成 PR4 分钟事件引擎", "分钟数据采集入库后 data_status 升级为 AVAILABLE"]
    },
    {
      "capability": "stock_tick_backtest",
      "required": false,
      "event_type": "tick",
      "schema_status": "SCHEMA_ONLY",
      "data_status": "DATA_MISSING",
      "adapter_status": "ADAPTER_MISSING",
      "provider_status": "PROVIDER_MISSING",
      "engine_status": "PLANNED",
      "platform_status": "PLATFORM_DEPENDENT",
      "execution_status": "PLANNED",
      "evidence": ["Tick schema placeholder"],
      "message": "Tick 仅可表达，当前不可执行。",
      "remediation": ["完成 PR9 Tick/L2 能力"]
    }
  ],
  "overall_execution_status": "READY",
  "blockers": [],
  "repair_actions": []
}
